{
  "spec_version": 1,
  "id": "astar-probe-pilot",
  "title": "a* probe as a spec (equivalence pilot for core_saturation_search.run_probe)",
  "description": "Same params, IC and dt as the a* harnesses (FEB with param_a x1.15, K=6 per-blob multiseed IC, seed 20260619, L=10, dt=0.005), short T so it doubles as an equivalence test against run_probe's er(t).",
  "branch": "Branch - Stability - Index",
  "substrate": {"name": "etdrk4-sncgl", "version": 1, "params": {
    "param_D": 2.7329, "param_eta": 0.0704, "param_rho_vac": 1.1866, "param_omega0": 0.0,
    "param_a_coupling": 2.3098, "param_s": 0.0129, "param_f": -0.4861, "param_a": 0.55223}},
  "protocol": {
    "ic": {"name": "multiseed", "version": 1, "params": {"K": 6, "seed": 20260619}},
    "grid": {"N": 32, "L": 10.0},
    "dt": 0.005,
    "T": 1.0,
    "sample_every": 0.005
  },
  "observers": [{"name": "energy_ratio", "version": 1}, {"name": "nodes", "version": 1}],
  "prediction": {
    "statement": "Over T=1 (200 steps) the a* field stays bounded: er remains below the classifier's 3.0 growth bound.",
    "quantities": [{"key": "er", "expected": 3.0, "kind": "le"}]
  },
  "budget_h": 0.1,
  "tags": ["pilot", "phase-E", "equivalence"]
}
