{
  "branch": "Branch - Stability - Index",
  "budget_h": 3.5,
  "description": "Generated by tools/screen_verify.py from the fp32 screen ASTAR_SCREEN_DEMO_FP32. Points: param_a=0.52__seed=20260622 (outlier, boundary, ic_split, representative); param_a=0.59__seed=20260619 (outlier, boundary, ic_split, representative); param_a=0.59__seed=20260621 (outlier, boundary, ic_split, representative); param_a=0.59__seed=20260622 (outlier, boundary, ic_split, representative); param_a=0.52__seed=20260619 (boundary, ic_split); param_a=0.52__seed=20260620 (boundary, ic_split); param_a=0.52__seed=20260621 (boundary, ic_split, representative); param_a=0.535__seed=20260619 (boundary, ic_split); param_a=0.535__seed=20260620 (boundary, ic_split, representative); param_a=0.535__seed=20260621 (boundary, ic_split); param_a=0.55223__seed=20260619 (boundary, ic_split, representative); param_a=0.55223__seed=20260621 (boundary, ic_split, representative); param_a=0.55223__seed=20260622 (boundary, ic_split); param_a=0.57__seed=20260619 (boundary, ic_split); param_a=0.57__seed=20260620 (boundary, ic_split, representative); param_a=0.57__seed=20260621 (boundary, ic_split); param_a=0.59__seed=20260620 (boundary, ic_split).",
  "id": "astar-screen-demo-verify",
  "observers": [
    {
      "name": "energy_ratio",
      "version": 1
    },
    {
      "name": "nodes",
      "version": 1
    },
    {
      "name": "state_descriptors",
      "params": {
        "final_only": true
      },
      "version": 2
    }
  ],
  "prediction": {
    "quantities": [
      {
        "expected": 3.0,
        "key": "er",
        "kind": "le"
      }
    ],
    "statement": "From the pre-fix confirm run: all three seeds settle to a bounded standing state (er stays below the 3.0 growth bound); seed 619 ends with 4 nodes and seeds 620/621 with 6, i.e. at least two basins at a*. If the fixed integrator changes the node counts, that is itself a re-validation finding."
  },
  "protocol": {
    "T": 360.0,
    "dt": 0.005,
    "grid": {
      "L": 10.0,
      "N": 32
    },
    "ic": {
      "name": "multiseed",
      "params": {
        "K": 6,
        "seed": 20260622
      },
      "version": 1
    },
    "precision": "fp64",
    "sample_every": 7.2,
    "stop": {
      "nonfinite": true
    }
  },
  "spec_version": 1,
  "substrate": {
    "name": "etdrk4-sncgl",
    "params": {
      "param_D": 2.7329,
      "param_a": 0.52,
      "param_a_coupling": 2.3098,
      "param_eta": 0.0704,
      "param_f": -0.4861,
      "param_omega0": 0.0,
      "param_rho_vac": 1.1866,
      "param_s": 0.0129
    },
    "version": 1
  },
  "tags": [
    "phase-F",
    "basins",
    "a*"
  ],
  "title": "fp64 verification of 17 screen point(s) from ASTAR_SCREEN_DEMO_FP32",
  "sweep": {
    "mode": "zip",
    "axes": {
      "protocol.ic.params.seed": [
        20260622,
        20260619,
        20260621,
        20260622,
        20260619,
        20260620,
        20260621,
        20260619,
        20260620,
        20260621,
        20260619,
        20260621,
        20260622,
        20260619,
        20260620,
        20260621,
        20260620
      ],
      "substrate.params.param_a": [
        0.52,
        0.59,
        0.59,
        0.59,
        0.52,
        0.52,
        0.52,
        0.535,
        0.535,
        0.535,
        0.55223,
        0.55223,
        0.55223,
        0.57,
        0.57,
        0.57,
        0.59
      ]
    }
  }
}